<?xml version="1.0" encoding="UTF-8"?>
<testSessionLog
  xmlns="http://www.arkivverket.no/dataextracttools/arkade5/testsessionlog"
  xmlns:xsd="http://www.w3.org/2001/XMLSchema"
  xmlns:xsi="http://www.w3.org/2001/XMLSchema-instance"
  xsi:schemaLocation="http://www.arkivverket.no/dataextracttools/arkade5/testsessionlog testSessionLog.xsd" >

  <timestamp>2016-09-23T12:55:15.463+02:00</timestamp>
  <archiveUuid>2a4c611b-fc02-4ad0-8b11-1b9956eaa400</archiveUuid>
  <archiveType>Noark5</archiveType>
  <arkadeVersion>1.0.0</arkadeVersion>
  <testResults>
    <testResult>
      <testName>NumberOfFolders</testName>
      <testCategory>Noark5</testCategory>
      <durationMillis>50</durationMillis>
      <status>SUCCESS</status>
      <message>Found 2 classification systems</message>
    </testResult>
    <testResult>
      <testName>ValidateAddmlDataobjectsChecksums</testName>
      <testCategory>Noark5</testCategory>
      <testDescription>Test som validerer sjekksummen p√• alle filer i arkivuttrekket</testDescription>
      <durationMillis>534</durationMillis>
      <status>ERROR</status>
      <message>Checksum validated OK for file: 1.pdf with algorithm: SHA256. Checksum [39a3ee5e6b4b0d3255bfef95601890afd80709]</message>
      <errorMessage>Checksum mismatch for file 2.pdf with algorithm SHA256. Expected checksum [39a3ee5e6b4b0d3255bfef95601890afd80709]. Actual checksum [39a3ee5e6b4b0d3255bfef95601890afd80700]</errorMessage>
    </testResult>
  </testResults>

  <logEntries>
    <logEntry>
      <timestamp>2016-09-23T12:55:10.153+02:00</timestamp>
      <message>Test session started</message>
    </logEntry>
    <logEntry>
      <timestamp>2016-09-23T12:55:10.453+02:00</timestamp>
      <message>Archive 1.tar loaded</message>
    </logEntry>
    <logEntry>
      <timestamp>2016-09-23T12:55:15.352+02:00</timestamp>
      <message>Test session finished</message>
    </logEntry>
  </logEntries>
</testSessionLog>
